{
  "$comment": "Canonical facet profiles = the answer key the selection layer matches against. screenType resolution (step 1 of ai-pattern-selection-instructions.md) compares an incoming step's facets to these profiles. All facet values use the enums in ai-design-facets.schema.json; this file itself is validated by ai-canonical-profiles.schema.json (npm run validate:profiles). Semantics: typicalBlockRoles = the default composition for the screen type; optionalBlockRoles = additionally allowed roles, kept mechanically in sync as { R | S in R.screenTypes } minus typical; alternativeShells = swap-in replacements for the default navigation shell (a screen has at most one shell). State roles (empty-state / error-recovery / loading-skeleton) are selected as blocks only when the whole page is in that state; states inside a block are covered via stateCoverage instead. maturity uses the facets-schema enum: entries start at 'experimental' and the human owner promotes to 'canonical' by review (reviewed: true).",
  "version": "0.2.0",
  "generatedAt": "2026-07-08",
  "screenTypes": {
    "auth": {
      "reviewed": true,
      "maturity": "canonical",
      "userIntents": ["authenticate", "recover"],
      "jobMapStages": ["prepare"],
      "dataShapes": ["single-record", "none"],
      "interactionModels": ["form-submit", "single-action"],
      "density": "low",
      "typicalBlockRoles": ["form-section", "action-footer", "error-recovery"],
      "notes": "Login, signup, password reset, MFA. Single centered task, no nav shell, no dense data."
    },
    "onboarding": {
      "reviewed": true,
      "maturity": "canonical",
      "userIntents": ["onboard", "configure", "create"],
      "jobMapStages": ["define", "prepare"],
      "dataShapes": ["single-record", "none"],
      "interactionModels": ["wizard", "form-submit", "disclosure"],
      "density": "low",
      "typicalBlockRoles": ["wizard-stepper", "form-section", "action-footer", "empty-state"],
      "optionalBlockRoles": ["file-upload-area"],
      "notes": "First-run setup, guided setup, import/connect. Sequential steps, low density."
    },
    "dashboard": {
      "reviewed": true,
      "maturity": "canonical",
      "userIntents": ["monitor", "analyze", "compare", "browse"],
      "jobMapStages": ["monitor"],
      "dataShapes": ["metric", "time-series", "collection", "categorical"],
      "interactionModels": ["read-only", "filter-sort", "drawer-inspection", "real-time"],
      "density": "high",
      "typicalBlockRoles": ["app-shell-sidebar", "page-header-actions", "summary-metric-row", "chart-panel", "data-table-panel", "filter-toolbar"],
      "optionalBlockRoles": ["command-search", "notification-center", "drawer-inspector", "activity-feed", "ai-explainability-label", "empty-state", "error-recovery", "loading-skeleton"],
      "alternativeShells": ["app-shell-topnav"],
      "notes": "Operational overview with KPIs, charts, and a table. High density, nav shell present, continuously updating data (real-time). Distinguish from report-analytics: monitoring is time-sensitive at-a-glance consumption."
    },
    "collection": {
      "reviewed": true,
      "maturity": "canonical",
      "userIntents": ["browse", "search", "filter", "compare"],
      "jobMapStages": ["locate"],
      "dataShapes": ["collection", "categorical"],
      "interactionModels": ["filter-sort", "selection-multiple", "selection-single", "disclosure"],
      "density": "high",
      "typicalBlockRoles": ["app-shell-sidebar", "page-header-actions", "filter-toolbar", "tabs-view-switcher", "data-table-panel", "collection-grid", "empty-state", "loading-skeleton"],
      "optionalBlockRoles": ["breadcrumb-context", "command-search", "notification-center", "modal-dialog", "drawer-inspector", "error-recovery"],
      "alternativeShells": ["app-shell-topnav"],
      "notes": "List/table/grid resource browser. Distinguish from dashboard: primary job is browsing many records, not monitoring metrics."
    },
    "detail": {
      "reviewed": true,
      "maturity": "canonical",
      "userIntents": ["review", "edit", "browse"],
      "jobMapStages": ["locate", "confirm"],
      "dataShapes": ["single-record", "relational", "media", "document"],
      "interactionModels": ["read-only", "disclosure", "inline-edit", "drawer-inspection"],
      "density": "medium",
      "typicalBlockRoles": ["page-header-actions", "breadcrumb-context", "detail-overview", "activity-feed", "comment-thread", "action-footer"],
      "optionalBlockRoles": ["app-shell-sidebar", "app-shell-topnav", "command-search", "tabs-view-switcher", "notification-center", "modal-dialog", "drawer-inspector", "file-upload-area", "ai-explainability-label", "empty-state", "error-recovery", "loading-skeleton"],
      "notes": "Entity/record/profile page. One primary record plus related context."
    },
    "create-edit": {
      "reviewed": true,
      "maturity": "canonical",
      "userIntents": ["create", "edit", "configure"],
      "jobMapStages": ["execute"],
      "dataShapes": ["single-record", "relational"],
      "interactionModels": ["form-submit", "inline-edit", "multi-action"],
      "density": "medium",
      "typicalBlockRoles": ["page-header-actions", "form-section", "action-footer", "file-upload-area"],
      "optionalBlockRoles": ["modal-dialog"],
      "notes": "Form page or editor for creating/updating one record. Not a multi-step wizard (use workflow/onboarding for that)."
    },
    "settings-admin": {
      "reviewed": true,
      "maturity": "canonical",
      "userIntents": ["configure", "edit", "approve", "review"],
      "jobMapStages": ["modify"],
      "dataShapes": ["single-record", "permission-model", "relational"],
      "interactionModels": ["form-submit", "inline-edit", "selection-single"],
      "density": "medium",
      "typicalBlockRoles": ["app-shell-sidebar", "settings-section", "form-section", "action-footer"],
      "optionalBlockRoles": ["breadcrumb-context", "tabs-view-switcher", "modal-dialog", "pricing-plan-card"],
      "notes": "Preferences, team/admin, billing, permissions. Sectioned settings, often with a secondary nav."
    },
    "workflow": {
      "reviewed": true,
      "maturity": "canonical",
      "userIntents": ["approve", "review", "purchase", "create"],
      "jobMapStages": ["confirm", "execute", "conclude"],
      "dataShapes": ["transaction", "single-record"],
      "interactionModels": ["wizard", "form-submit", "multi-action", "human-in-the-loop"],
      "density": "medium",
      "typicalBlockRoles": ["wizard-stepper", "form-section", "action-footer", "checkout-summary"],
      "optionalBlockRoles": ["pricing-plan-card"],
      "notes": "Stepper, approval flow, checkout-like transactional flow. Progress toward a committed transaction."
    },
    "report-analytics": {
      "reviewed": true,
      "maturity": "canonical",
      "userIntents": ["analyze", "compare", "review"],
      "jobMapStages": ["conclude"],
      "dataShapes": ["metric", "time-series", "categorical", "collection"],
      "interactionModels": ["read-only", "filter-sort"],
      "density": "high",
      "typicalBlockRoles": ["page-header-actions", "filter-toolbar", "chart-panel", "data-table-panel", "summary-metric-row"],
      "optionalBlockRoles": ["app-shell-topnav", "empty-state", "error-recovery", "loading-skeleton"],
      "notes": "Longer readout / exportable report over historical data. Distinguish from dashboard: deep analysis of trends, not time-sensitive monitoring; no real-time updates."
    },
    "conversation-assistant": {
      "reviewed": true,
      "maturity": "canonical",
      "userIntents": ["communicate", "delegate-to-ai", "review"],
      "jobMapStages": ["define", "execute"],
      "dataShapes": ["conversation", "document", "media"],
      "interactionModels": ["streaming", "real-time", "human-in-the-loop", "single-action"],
      "density": "medium",
      "typicalBlockRoles": ["ai-conversation-list", "ai-prompt-composer", "ai-explainability-label", "activity-feed"],
      "optionalBlockRoles": ["comment-thread"],
      "notes": "AI chat, support thread, agent workspace. Streaming turn-based interaction."
    }
  },
  "blockRoles": {
    "app-shell-sidebar": {
      "reviewed": true, "maturity": "canonical",
      "layoutModel": { "region": "sidebar" },
      "userIntents": ["browse"],
      "dataShapes": ["hierarchy"],
      "interactionModels": ["disclosure", "selection-single"],
      "screenTypes": ["dashboard", "collection", "settings-admin", "detail"],
      "notes": "Primary left navigation shell. Only one navigation shell per screen."
    },
    "app-shell-topnav": {
      "reviewed": true, "maturity": "canonical",
      "layoutModel": { "region": "header" },
      "userIntents": ["browse"],
      "dataShapes": ["hierarchy"],
      "interactionModels": ["disclosure", "selection-single"],
      "screenTypes": ["dashboard", "collection", "detail", "report-analytics"],
      "notes": "Top navigation shell. Alternative to sidebar (see alternativeShells); do not combine both. Prefer for shallow navigation structures."
    },
    "page-header-actions": {
      "reviewed": true, "maturity": "canonical",
      "layoutModel": { "region": "header" },
      "userIntents": ["create", "edit", "browse"],
      "dataShapes": ["none"],
      "interactionModels": ["multi-action", "single-action"],
      "screenTypes": ["dashboard", "collection", "detail", "create-edit", "report-analytics"],
      "notes": "Page title plus primary actions (create, export, etc.)."
    },
    "breadcrumb-context": {
      "reviewed": true, "maturity": "canonical",
      "layoutModel": { "region": "header" },
      "userIntents": ["browse"],
      "dataShapes": ["hierarchy"],
      "interactionModels": ["read-only", "disclosure"],
      "screenTypes": ["detail", "collection", "settings-admin"],
      "notes": "Location context within a hierarchy."
    },
    "command-search": {